{"$schema":"https://json-schema.org/draft/2020-12/schema","$id":"https://github.com/rezahh107/EV4-Builder-Assistant-Repo/schemas/completion-status.schema.json","title":"EV4 Completion Status","type":"object","required":["schema","states","claim_scope","production_ready"],"properties":{"schema":{"const":"ev4-completion-status@1.0.0"},"completion_scope":{"type":"string","minLength":1},"reference_paradigm_lock_present":{"type":"boolean"},"scope_excludes_responsive":{"type":"boolean"},"responsive_complete":{"type":"boolean"},"claim_scope":{"enum":["element","desktop","section","production_ready","acceptable"]},"acceptable_scope":{"type":"string"},"acceptable_checklist":{"type":"string"},"production_ready":{"type":"boolean"},"evidence":{"type":"object","properties":{"layout":{"type":"boolean"},"frontend":{"type":"boolean"},"responsive":{"type":"boolean"},"accessibility":{"type":"boolean"},"browser":{"type":"boolean"},"export":{"type":"boolean"},"final_qa":{"type":"boolean"}},"additionalProperties":false},"states":{"type":"object","required":["scaffold_built","structure_built","content_filled","desktop_layout_established","desktop_reference_paradigm_matched","desktop_visual_parity_checked","tablet_checked","mobile_checked","accessibility_checked","browser_checked","export_checked","final_frontend_QA_checked"],"properties":{"scaffold_built":{"type":"boolean"},"structure_built":{"type":"boolean"},"content_filled":{"type":"boolean"},"desktop_layout_established":{"type":"boolean"},"desktop_reference_paradigm_matched":{"type":"boolean"},"desktop_visual_parity_checked":{"type":"boolean"},"tablet_checked":{"type":"boolean"},"mobile_checked":{"type":"boolean"},"accessibility_checked":{"type":"boolean"},"browser_checked":{"type":"boolean"},"export_checked":{"type":"boolean"},"final_frontend_QA_checked":{"type":"boolean"}},"additionalProperties":false}},"additionalProperties":false}
