{
  "schema": "ev4-completion-status@1.0.0",
  "reference_paradigm_lock_present": false,
  "scope_excludes_responsive": true,
  "claim_scope": "desktop",
  "production_ready": false,
  "evidence": {
    "frontend": false,
    "responsive": false,
    "accessibility": false,
    "browser": false,
    "export": true,
    "final_qa": false
  },
  "states": {
    "scaffold_built": true,
    "structure_built": true,
    "content_filled": true,
    "desktop_layout_established": true,
    "desktop_reference_paradigm_matched": false,
    "desktop_visual_parity_checked": false,
    "tablet_checked": false,
    "mobile_checked": false,
    "accessibility_checked": false,
    "browser_checked": false,
    "export_checked": true,
    "final_frontend_QA_checked": false
  }
}
