{"schema":"ev4-completion-status@1.0.0","reference_paradigm_lock_present":true,"claim_scope":"desktop","production_ready":false,"states":{"scaffold_built":true,"structure_built":true,"content_filled":false,"desktop_layout_established":true,"desktop_reference_paradigm_matched":true,"desktop_visual_parity_checked":false,"tablet_checked":false,"mobile_checked":false,"accessibility_checked":false,"browser_checked":false,"export_checked":false,"final_frontend_QA_checked":false}}
